{
  "allowlist": [
    "schema",
    "revision",
    "status",
    "title",
    "release",
    "evidence_coverage",
    "allowlist",
    "input_sha256",
    "content_sha256",
    "sections",
    "paragraphs",
    "thesis_nodes",
    "argument_objects",
    "graph_edges",
    "claims",
    "sources",
    "chunks",
    "contribution_lanes"
  ],
  "argument_objects": [
    {
      "argument_id": "ARG-0001",
      "argument_type": "supporting_argument",
      "epistemic_status": "Inferred",
      "evidence_refs": [
        "CLM-0001",
        "CLM-0014",
        "SRC-0002",
        "SRC-0047",
        "SRC-0048"
      ],
      "node_type": "argument_object",
      "review_state": "candidate",
      "statement": "Documents are only one projection of professional knowledge; recurring relationships among people, tasks, tools, exceptions, choices, rationales, and outcomes can encode valuable operating and judgment patterns.",
      "title": "The brain trust is an interaction graph"
    },
    {
      "argument_id": "ARG-0002",
      "argument_type": "supporting_argument",
      "epistemic_status": "Hypothesis",
      "evidence_refs": [
        "CLM-0015",
        "SRC-0046"
      ],
      "node_type": "argument_object",
      "review_state": "candidate",
      "statement": "If many firms authorize retention or generalized improvement from overlapping professional interaction data, each contribution may strengthen a shared upstream capability whose benefits and competitive effects extend beyond the contributing firm.",
      "title": "Peer contribution can create a sector externality"
    },
    {
      "argument_id": "ARG-0004",
      "argument_type": "supporting_argument",
      "epistemic_status": "Inferred",
      "evidence_refs": [
        "CLM-0011",
        "CLM-0013",
        "SRC-0042",
        "SRC-0043",
        "SRC-0045"
      ],
      "node_type": "argument_object",
      "review_state": "candidate",
      "statement": "AlphaGo's Move 37 demonstrates that learned evaluation and search in a closed strategic domain can select an unconventional action whose value becomes clear much later; it motivates testing for analogous delayed-value legal strategies.",
      "title": "Move-37-like strategic discontinuity is possible but unproven in law"
    },
    {
      "argument_id": "FAL-0001",
      "argument_type": "falsifier",
      "epistemic_status": "Hypothesis",
      "evidence_refs": [
        "SRC-0005",
        "SRC-0007",
        "SRC-0009"
      ],
      "node_type": "argument_object",
      "review_state": "candidate",
      "statement": "The provider-mediated sector-externality mechanism is weakened for a bounded deployment if independent contractual and technical evidence proves that ordinary and optional paths prevent retention, cross-customer use, generalized improvement, and semantic derivative reuse.",
      "title": "Verified isolation and no generalized derivation"
    },
    {
      "argument_id": "FAL-0002",
      "argument_type": "falsifier",
      "epistemic_status": "Hypothesis",
      "evidence_refs": [],
      "node_type": "argument_object",
      "review_state": "candidate",
      "statement": "The overlap thesis weakens if reproducible experiments show that multi-firm interaction abstractions do not improve legal strategy, workflow, or evaluation performance over public-only and single-firm baselines.",
      "title": "No measurable substitution from multi-firm traces"
    },
    {
      "argument_id": "FAL-0003",
      "argument_type": "falsifier",
      "epistemic_status": "Hypothesis",
      "evidence_refs": [
        "CLM-0013",
        "SRC-0045"
      ],
      "node_type": "argument_object",
      "review_state": "candidate",
      "statement": "The existential competitive framing weakens if legal strategy capability plateaus despite additional compute, algorithms, tools, public data, and synthetic experience, or remains dependent on non-transferable human context.",
      "title": "Frontier legal strategy plateaus"
    },
    {
      "argument_id": "GAP-0001",
      "argument_type": "proof_gap",
      "epistemic_status": "Unknown",
      "evidence_refs": [],
      "node_type": "proof_gap",
      "review_state": "candidate",
      "statement": "The repository has no representative measure of how much operational and professional-judgment ontology overlaps across large law firms or how much unique alpha remains after normalization.",
      "title": "Law-firm ontology overlap is unmeasured"
    },
    {
      "argument_id": "GAP-0002",
      "argument_type": "proof_gap",
      "epistemic_status": "Unknown",
      "evidence_refs": [
        "CLM-0010",
        "SRC-0002",
        "SRC-0005"
      ],
      "node_type": "proof_gap",
      "review_state": "candidate",
      "statement": "No registered evidence establishes that a named provider aggregates ordinary law-firm interaction patterns across customers for generalized model, product, or strategy improvement.",
      "title": "Provider aggregation and use are unproven"
    },
    {
      "argument_id": "GAP-0003",
      "argument_type": "proof_gap",
      "epistemic_status": "Unknown",
      "evidence_refs": [
        "CLM-0011",
        "SRC-0042"
      ],
      "node_type": "proof_gap",
      "review_state": "candidate",
      "statement": "There is no registered benchmark that reliably identifies unconventional, delayed-value legal strategies while measuring legal correctness, duties, client objectives, institutional legitimacy, and downstream consequences.",
      "title": "No validated legal Move 37 benchmark"
    },
    {
      "argument_id": "OBJ-0001",
      "argument_type": "objection",
      "epistemic_status": "Observed",
      "evidence_refs": [
        "CLM-0003",
        "CLM-0010",
        "SRC-0002",
        "SRC-0005"
      ],
      "node_type": "argument_object",
      "review_state": "candidate",
      "statement": "The public record reviewed does not establish that Anthropic or another named frontier provider covertly pools identifiable law-firm ontologies or trains on ordinary commercial content by default.",
      "title": "No evidence of current covert pooling"
    },
    {
      "argument_id": "OBJ-0002",
      "argument_type": "objection",
      "epistemic_status": "Hypothesis",
      "evidence_refs": [
        "CLM-0008",
        "SRC-0041"
      ],
      "node_type": "argument_object",
      "review_state": "candidate",
      "statement": "Firm-controlled AI can improve quality, speed, access, consistency, training, and strategic experimentation, so external AI use need not flatten law firms or transfer their control plane.",
      "title": "AI can complement and differentiate firms"
    },
    {
      "argument_id": "OBJ-0003",
      "argument_type": "objection",
      "epistemic_status": "Observed",
      "evidence_refs": [
        "SRC-0036",
        "SRC-0037"
      ],
      "node_type": "argument_object",
      "review_state": "candidate",
      "statement": "Statutes, opinions, public filings, forms, professional rules, and widely used workflows limit the portion of legal knowledge that any firm can claim as unique or defensibly withhold.",
      "title": "The common legal layer is not proprietary"
    },
    {
      "argument_id": "OBJ-0004",
      "argument_type": "objection",
      "epistemic_status": "Observed",
      "evidence_refs": [
        "CLM-0011",
        "CLM-0012",
        "SRC-0042",
        "SRC-0044"
      ],
      "node_type": "argument_object",
      "review_state": "candidate",
      "statement": "Go has fixed rules, a complete visible state, cheap self-play, and a clean objective; law is open, institutional, normative, fact-dependent, relationship-dependent, and governed by professional duties.",
      "title": "Go is not law"
    },
    {
      "argument_id": "OBJ-0005",
      "argument_type": "objection",
      "epistemic_status": "Inferred",
      "evidence_refs": [
        "CLM-0012",
        "SRC-0044"
      ],
      "node_type": "argument_object",
      "review_state": "candidate",
      "statement": "AlphaGo Zero demonstrates that a system in a closed strategic domain can surpass expert-trained predecessors through self-play without human game data, so withholding private expert examples may deny a shortcut without preventing formidable capability.",
      "title": "Private expert traces may be unnecessary"
    },
    {
      "argument_id": "REB-0001",
      "argument_type": "rebuttal",
      "epistemic_status": "Normative",
      "evidence_refs": [
        "CLM-0003",
        "CLM-0004",
        "CLM-0005",
        "SRC-0005",
        "SRC-0007",
        "SRC-0009",
        "SRC-0034"
      ],
      "node_type": "argument_object",
      "review_state": "candidate",
      "statement": "The Ajax Line does not reject AI; it calls for firm-controlled ontology, evaluation, rights, telemetry, portability, and audit so firms can obtain benefits without granting an unexamined upstream learning right.",
      "title": "Precautionary sovereignty is compatible with adoption"
    },
    {
      "argument_id": "THS-0001",
      "argument_type": "thesis",
      "epistemic_status": "Normative",
      "evidence_refs": [
        "CLM-0001",
        "CLM-0003",
        "CLM-0015",
        "CLM-0016",
        "SRC-0046",
        "SRC-0047",
        "SRC-0048",
        "SRC-0049"
      ],
      "node_type": "argument_object",
      "review_state": "candidate",
      "statement": "Each major law firm should independently maintain a defensive boundary around its collective attorney brain-trust data and derived representations because peer exposure could create an upstream capability that reduces overlapping differentiation, including for protective holdouts.",
      "title": "The Ajax Line: hold the line"
    }
  ],
  "chunks": [
    {
      "chunk_id": "chk:sha256:df2e7459bf10d78ca10b60de738be13e2b81fe0345df0f28c01dfc14a4136227",
      "chunk_kind": "static_file_span",